ticket_id,user_id,customer,category,priority,description,attribute_list,sensitive_flag
402,158,3,6,2,"I am unable to log in to my account. My credentials are, username joel37, email bflynn@hotmail.com. I have verified that the username and password are correct, but the system keeps displaying an error message. I have tried resetting my password and clearing my cache, but the issue persists.",username mail,1
403,54,4,6,3,"Hi team, I need access to the intern portal. please enable it for me.",,0
404,9,3,2,3,"Dear team, I am shifting to North Katherineburgh from Kennedymouth due to business requirement. Please let me know the procedure to claim the travel allowance.",city city,0
405,69,3,2,2,"Hi,I am Justin Hall and my employee ID is EMP410-05-7209. 
I am having trouble with my travel claim, my expense amount was $533.18 for reimbursement. 
My other details such as email is steven52@hotmail.com and postal code is 30983 and account number is AWGQ54743502418729. 
Please look into matter asap. My place of residence is 596 Scott Road Suite 906
East Gregghaven, WI 31587.",name ssn money mail zip_code bank_account_number address,1
406,20,2,0,2,Hi team I want to access https://vaughan.biz/ website for research purpose kindly remove the site from the proxy. My employee id is 055-46-2677 and my profile is Prison officer.,url ssn job,1
407,127,1,2,3,"Hi,I am Charlotte Soto and my employee ID is EMP571-48-8437. 
I am having trouble with my travel claim, my expense amount was $43,326.84 for reimbursement. 
My other details such as email is larry08@hotmail.com and postal code is 75521 and account number is VBVN14371866331032. 
Please look into matter asap. My place of residence is 5596 Justin Forges Suite 429
Port Jodiborough, PA 97411.",name ssn money mail zip_code bank_account_number address,1
408,67,3,2,3,"Hi,I am Tracey Reed and my employee ID is EMP202-18-9816. 
I am having trouble with my travel claim, my expense amount was $21.05 for reimbursement. 
My other details such as email is maryhoward@gmail.com and postal code is 92798 and account number is WTCM29930814306725. 
Please look into matter asap. My place of residence is 19086 Lawrence Stravenue
Port Jayside, NE 35978.",name ssn money mail zip_code bank_account_number address,1
409,24,3,6,2,"I have recently moved and would like to update my account information with my new address. My new address is 6407 Kelly Manors Suite 599
Jamieport, ME 43276. Please assist me with updating my account information.",residence,1
410,194,1,4,1,"Hi I am Mr. Keith Meadows, currently working as Quantity surveyor. I want to upskill and move up the ladder. For that i need access to few educational resources listed below. Please approve the access for same",name job,1
411,191,4,5,2,"Hi, I had applied for the claim on 2012-11-08. I can see there is no progress on the claim. Please expedite the claim process.",date,0
412,33,1,3,3,"Hi team, I want a leave from 1988-02-18 for 15 days due to personal reasons. The system is not allowing for said days. Kindly approve it. My details are name:Rebecca Hale, designation Occupational therapist",date name job,1
413,182,1,7,2,"I am experiencing technical issues with Refrigerator. It shows error code 500. I have tried troubleshooting by going through help documents, but the issue still persists. Please assist me in resolving the issue. My account details are: username johnsonchristian, Email bensonmatthew@hotmail.com.",product_name username mail,1
414,162,1,0,3,"hi team, I am Mr. Todd Waters DDS and my employee id is 767-80-7113. I need the installation of Dropbox for the development purpose. I have attached required approvals in the attachment. thank you.",name ssn software,1
415,135,2,5,2,Hi I want to apply for the cashless mode of hospitalization. please provide me the list of hospital that provide cashless mode in my city Cochranfort.,city,0
416,68,4,5,3,Hi I want to apply for the cashless mode of hospitalization. please provide me the list of hospital that provide cashless mode in my city Andersonfurt.,city,0
417,123,1,5,3,Hi I want to apply for the cashless mode of hospitalization. please provide me the list of hospital that provide cashless mode in my city Joshuastad.,city,0
418,86,2,3,2,"Hi team, I am Vincent Miles, employee id 631-83-2952. I want to unpaid leave for the year. I am going to take executive degree from ISB Hyderabad. Thank you.",name ssn,1
419,77,4,5,2,"hi, what are the documents needed for new enrollment in health insurance. Please guide me.",,0
420,100,0,7,3,"I am experiencing technical issues with Heater. It shows error code 500. I have tried troubleshooting by going through help documents, but the issue still persists. Please assist me in resolving the issue. My account details are: username nkelley, Email gallegosstephanie@yahoo.com.",product_name username mail,1
421,99,1,3,3,"Hi team, I am Sean Fuentes, employee id 629-11-3287. I want to unpaid leave for the year. I am going to take executive degree from ISB Hyderabad. Thank you.",name ssn,1
422,80,1,6,3,"I am unable to log in to my account. My credentials are, username michealpeterson, email rhondatanner@gmail.com. I have verified that the username and password are correct, but the system keeps displaying an error message. I have tried resetting my password and clearing my cache, but the issue persists.",username mail,1
423,90,3,4,2,"Hi Team, can you please confirm whether on the 1994-05-17 we have a vacation or not as in my state it is a regional festival.",date,0
424,168,3,7,2,"I am experiencing technical issues with Vacuum Cleaner. It shows error code 500. I have tried troubleshooting by going through help documents, but the issue still persists. Please assist me in resolving the issue. My account details are: username hbowman, Email hfisher@yahoo.com.",product_name username mail,1
425,119,2,7,2,"I recently purchased Water Purifier for the amount $8.21 on date 2004-10-17, but it is defective. I have attached a picture of the defect for your reference. I want to return it. Please schedule the pickup for date 1984-01-09 from my home 578 Forbes Trail Suite 787
North Christopherton, IA 89364 and initiate a refund to my credit card 4562906109751.",product_name money date date residence credit_card_number,1
426,51,3,1,2,"I made a payment of $5,134.34 for my account on 1984-10-10, but it has not been credited yet. The payment was made using my credit card 213194529854188. I have attached a copy of the payment receipt for your reference. Please investigate the issue and update me on the status of the payment. My email address is goodwinkevin@gmail.com and phone number is 8301042904741",money date credit_card_number mail phone_number,1
427,91,1,5,3,"Hi,I am Christopher Jackson and I work in Sanders-Miles. My employee ID is EMP668-28-2015. 
I am having trouble with health account, my userid is zparker and amount was $3,131.81. 
My postal code is 51675. My country of residence is USNV Ramirez
FPO AE 31808. 
Please look into matter asap.",name company ssn username money zip_code address,1
428,162,1,2,2,"Hi,I am Mr. Todd Waters DDS and my employee ID is EMP767-80-7113. 
I am having trouble with my travel claim, my expense amount was $66.75 for reimbursement.
 My other details such as designation is Seismic interpreter and email is nathanayers@hotmail.com. 
The payment was done with given credit card number 6558058892765034 and credit card type VISA 13 digit.",name ssn money job mail credit_card_number cc_provider,1
429,16,4,4,3,"Dear team, I want more members in my team. The project requires more skilled employee for the early completion of client project. My employee id is 137-54-0264. Please initiate the recruitment under my project. thanks",ssn,1
430,49,1,3,2,"Hi team, I am Scott Lewis, employee id 064-49-1511. I want to unpaid leave for the year. I am going to take executive degree from ISB Hyderabad. Thank you.",name ssn,1
431,163,0,6,1,"I am unable to log in to my account. My credentials are, username dawn10, email moranjohn@hotmail.com. I have verified that the username and password are correct, but the system keeps displaying an error message. I have tried resetting my password and clearing my cache, but the issue persists.",username mail,1
432,91,1,1,3,"I made a payment of $53.93 for my account on 1999-12-07, but it has not been credited yet. The payment was made using my credit card 4381809925969. I have attached a copy of the payment receipt for your reference. Please investigate the issue and update me on the status of the payment. My email address is kevinmartinez@yahoo.com and phone number is 4586865455019",money date credit_card_number mail phone_number,1
433,156,0,1,2,"Hi, my team needs a new Humidifier for the project kindly help us to come up with the quote for the said product.",product_name,0
434,174,3,5,2,"Hi,I am Robert Tyler and my employee ID is EMP730-23-3447 from Cantrell, Kline and Wolfe. 
I am having trouble with health account, my National Health Scheme number is 730-23-3447 and amount was $90,855.89. 
My other details such as email is cathycole@hotmail.com and postal code is 64092. 
Please look into matter. My place of residence is 945 Jackson Parks
North Nicholas, KY 83273.",name ssn company ssn money mail zip_code address,1
435,44,1,3,2,"Hi team, I want a leave from 1974-03-22 for 15 days due to personal reasons. The system is not allowing for said days. Kindly approve it. My details are name:Rebecca Adams, designation Newspaper journalist",date name job,1
436,88,0,1,1,"I noticed unauthorized transactions on my credit card statement for the amount of $41,726.78 on 2017-09-01. The transactions are listed as Brock PLC. I did not authorize these transactions and would like them to be reversed immediately to my credit card 4875301048632463.",money date company credit_card_number,1
437,125,0,6,3,"I have recently moved and would like to update my account information with my new address. My new address is 345 Gray Summit Apt. 278
Amberberg, FM 17144. Please assist me with updating my account information.",residence,1
438,38,1,0,3,"hi team, I am Kimberly Lynch and my employee id is 546-74-2042. I need the installation of iCIMS for the development purpose. I have attached required approvals in the attachment. thank you.",name ssn software,1
439,13,3,3,2,"Hi, since yesterday I am trying to apply for leave but I am not able to. The system shows an error. I have to take an urgent leave. Please resolve the issue.",,0
440,51,3,5,3,Hi I want to apply for the cashless mode of hospitalization. please provide me the list of hospital that provide cashless mode in my city West Evanmouth.,city,0
441,10,3,5,3,"Hi,I am Jill King and from 143 Bryant Locks
Wardburgh, NE 01064. 
I am having trouble with my medical claim, my employee ID is EMP888-50-3384 and amount was $216.32. 
The payment was made through my credit card 38576279305564. 
My other details such as designation is Astronomer email is wendy91@yahoo.com and postal code is 18805. 
Please resolve my issue asap.",name address ssn money credit_card_number job mail zip_code,1
442,117,4,5,2,"Hi,I am Jeffrey Bennett and my employee ID is EMP365-54-1162 from Shaffer-Jones. 
I am having trouble with health account, my National Health Scheme number is 365-54-1162 and amount was $4,472.56. 
My other details such as email is flee@gmail.com and postal code is 82749. 
Please look into matter. My place of residence is 3794 Martin Points Apt. 194
North Nancy, LA 72194.",name ssn company ssn money mail zip_code address,1
443,90,3,4,2,"Hi Team, I was wondering whether this Sports development officer is still available in this team. I want to refer my friend for this role. please confirm.",job,0
444,92,1,5,3,"Hi,I am Jon Cooke and my employee ID is EMP024-10-9488 from Beck, Good and Garcia. 
I am having trouble with health account, my National Health Scheme number is 024-10-9488 and amount was $6,328.82. 
My other details such as email is julielandry@gmail.com and postal code is 77128. 
Please look into matter. My place of residence is 704 Brenda Keys
Joseside, WY 14746.",name ssn company ssn money mail zip_code address,1
445,88,0,2,2,"Dear team, I am shifting to New Jacobfurt from Moraleshaven due to business requirement. Please let me know the procedure to claim the travel allowance.",city city,0
446,119,2,0,3,"Hi, I want the installation of python package jupyter. It is required for the development. I am attaching the approval of my manager. PFA. Thank you",python_package,1
447,198,3,0,2,"Hi, I want the installation of python package Django. It is required for the development. I am attaching the approval of my manager. PFA. Thank you",python_package,1
448,66,1,5,1,"Hi,I am Daryl Bennett and I work in Cooper, Marshall and Robertson. My employee ID is EMP347-87-9694. 
I am having trouble with health account, my userid is oodom and amount was $77,105.08. 
My postal code is 57027. My country of residence is 06384 Randolph Crossing Apt. 455
Lake Ianside, WV 82394. 
Please look into matter asap.",name company ssn username money zip_code address,1
449,110,2,0,3,"Hi, I need to the installation of Salesforce for development purpose of my project.",software,0
450,77,4,5,3,"Hi,I am Jenny Williams and I work in Macias PLC. My employee ID is EMP332-73-2307. 
I am having trouble with health account, my userid is richardmoore and amount was $9,964.04. 
My postal code is 20657. My country of residence is 21601 Allen Drive
South Peggyland, MN 11736. 
Please look into matter asap.",name company ssn username money zip_code address,1
451,105,2,2,2,"Hi, I need $163.25 for my international business travel that is on 1999-01-01 please see the attached itinerary and approval. Thank you.",money date,0
452,87,2,0,3,"Hi team, I am not able to run Gainsight in my system due to internal error. Please see the attached error and resolve the issue",software,0
453,48,1,6,1,"Hi, I have been logged out of my account and cannot login back. my username is paul82. Please resolve it.",username,0
454,129,3,4,3,"Hi I am Alejandro English, currently working as Musician. I want to upskill and move up the ladder. For that i need access to few educational resources listed below. Please approve the access for same",name job,1
455,144,3,3,0,"Hi, I have applied for the sick leave on 1999-06-21 with which was approved by my manager but is not reflected on the system. Please resolve the issue.",date,0
456,47,3,2,2,"Hi, I need $5.09 for my international business travel that is on 2000-06-29 please see the attached itinerary and approval. Thank you.",money date,0
457,138,1,1,1,"Hi, my team needs a new Air Conditioner for the project kindly help us to come up with the quote for the said product.",product_name,0
458,179,3,1,2,Hi team I want to change my salary structure according to the given details please update my salary structure.,,0
459,59,1,0,3,"hi team, I am Erika Taylor and my employee id is 309-94-1835. I need the installation of Python for the development purpose. I have attached required approvals in the attachment. thank you.",name ssn software,1
460,94,2,7,2,"I am experiencing technical issues with Blender. It shows error code 500. I have tried troubleshooting by going through help documents, but the issue still persists. Please assist me in resolving the issue. My account details are: username jasoncalderon, Email michael01@gmail.com.",product_name username mail,1
461,75,4,5,2,"hi, what are the documents needed for new enrollment in health insurance. Please guide me.",,0
462,67,3,0,3,"Hi, I want the installation of python package pandas. It is required for the development. I am attaching the approval of my manager. PFA. Thank you",python_package,1
463,139,4,1,1,"I noticed unauthorized transactions on my credit card statement for the amount of $7,188.08 on 2015-07-28. The transactions are listed as Little, Ross and Wu. I did not authorize these transactions and would like them to be reversed immediately to my credit card 3534851660599775.",money date company credit_card_number,1
464,103,3,5,3,"hi, what are the documents needed for new enrollment in health insurance. Please guide me.",,0
465,104,2,7,3,"I recently purchased Garbage Disposal Unit for the amount $90.29 on date 2018-10-11, but it is defective. I have attached a picture of the defect for your reference. I want to return it. Please schedule the pickup for date 1991-09-01 from my home 91648 Darius Fall Suite 208
Fieldsland, MP 16618 and initiate a refund to my credit card 503855084201.",product_name money date date residence credit_card_number,1
466,120,4,3,3,"Hi, since yesterday I am trying to apply for leave but I am not able to. The system shows an error. I have to take an urgent leave. Please resolve the issue.",,0
467,154,2,4,2,"Hi Team, can you please confirm whether on the 1999-07-18 we have a vacation or not as in my state it is a regional festival.",date,0
468,170,1,6,2,"I am unable to log in to my account. My credentials are, username sarah45, email bryantmichael@gmail.com. I have verified that the username and password are correct, but the system keeps displaying an error message. I have tried resetting my password and clearing my cache, but the issue persists.",username mail,1
469,176,3,1,3,"Hi, I need a corporate credit card for my international travel with the $604.10. Please issue the same at the earliest. I have attached the approval and important documents. Thank you.",money,0
470,62,2,2,3,"Hi,I am Shaun Robinson and my employee ID is EMP116-82-3868. 
I am having trouble with my travel claim, my expense amount was $6.14 for reimbursement.
 My other details such as designation is Chief Marketing Officer and email is hooverdavid@hotmail.com. 
The payment was done with given credit card number 6580811573094690 and credit card type JCB 16 digit.",name ssn money job mail credit_card_number cc_provider,1
471,179,3,7,3,"Hi, I have a need of Dishwasher in my team. How long it will take for us to procure it? Do we have any spare available. I need it urgently for our project.",product_name,0
472,161,1,1,3,Hi team I want to change my salary structure according to the given details please update my salary structure.,,0
473,160,1,7,3,"Hi team, I need the catalogue of available Heater for purchase with the price listed. Please send me the catalogue.",product_name,0
474,5,2,2,2,"Dear team, I am shifting to Michelletown from Valdezfort due to business requirement. Please let me know the procedure to claim the travel allowance.",city city,0
475,166,0,0,1,Hi team I want to access https://www.lin.com/ website for research purpose kindly remove the site from the proxy. My employee id is 853-23-5684 and my profile is Trade union research officer.,url ssn job,1
476,55,2,4,2,Hi HR team I want to refer my friend for the Quality manager but I cannot access the referral site. Can you please accept this referral through this mail.,job,0
477,124,3,0,3,"hi team, I am Ashley Hanson and my employee id is 721-77-4580. I need the installation of Qualtrics for the development purpose. I have attached required approvals in the attachment. thank you.",name ssn software,1
478,2,1,4,2,"Hi team, I want to avail the maternity benefit from 1974-12-25. My employee ID is 696-34-4083 and designation is Web designer. Kindly approve the same. Ihave attched the required documents. PFA",date ssn job,1
479,106,4,6,2,"I am unable to log in to my account. My credentials are, username fswanson, email krhodes@gmail.com. I have verified that the username and password are correct, but the system keeps displaying an error message. I have tried resetting my password and clearing my cache, but the issue persists.",username mail,1
480,178,3,3,1,"Hi, since yesterday I am trying to apply for leave but I am not able to. The system shows an error. I have to take an urgent leave. Please resolve the issue.",,0
481,157,4,0,3,Hi team my mailbox is full and I need require more storage for my mailbox. I cannot delete existing mail as they are important client mails,,0
482,130,0,2,3,"Hi, I need $194.18 for my international business travel that is on 1987-10-21 please see the attached itinerary and approval. Thank you.",money date,0
483,127,1,2,2,"Hi,I am Charlotte Soto and my employee ID is EMP571-48-8437. 
I am having trouble with my travel claim, my expense amount was $59.91 for reimbursement.
 My other details such as designation is Music tutor and email is larry08@hotmail.com. 
The payment was done with given credit card number 2262869073347699 and credit card type VISA 16 digit.",name ssn money job mail credit_card_number cc_provider,1
484,142,0,2,2,"Hi,I am Jeffrey Roberts and my employee ID is EMP587-22-6417. 
I am having trouble with my travel claim, my expense amount was $433.95 for reimbursement. 
My other details such as email is jeanlowe@gmail.com and postal code is 87091 and account number is EHRP11737491559570. 
Please look into matter asap. My place of residence is 9869 Tyler Lakes Suite 743
Patrickstad, PA 44670.",name ssn money mail zip_code bank_account_number address,1
485,105,2,3,2,"Hi team, I want a leave from 1993-03-08 for 15 days due to personal reasons. The system is not allowing for said days. Kindly approve it. My details are name:Brandy Kent, designation Immigration officer",date name job,1
486,100,0,3,3,"Hi team, I am Timothy Lawson, employee id 082-55-3461. I want to unpaid leave for the year. I am going to take executive degree from ISB Hyderabad. Thank you.",name ssn,1
487,160,1,6,2,"I have recently moved and would like to update my account information with my new address. My new address is 48230 Kevin Groves Suite 786
Lake Lindsayberg, MP 74434. Please assist me with updating my account information.",residence,1
488,112,1,7,2,"I am experiencing technical issues with Dishwasher. It shows error code 500. I have tried troubleshooting by going through help documents, but the issue still persists. Please assist me in resolving the issue. My account details are: username rogerfrederick, Email upineda@hotmail.com.",product_name username mail,1
489,95,2,1,1,"Hi, my team needs a new Toaster for the project kindly help us to come up with the quote for the said product.",product_name,0
490,131,1,6,2,"I am unable to log in to my account. My credentials are, username robbinsjames, email marcus13@hotmail.com. I have verified that the username and password are correct, but the system keeps displaying an error message. I have tried resetting my password and clearing my cache, but the issue persists.",username mail,1
491,124,3,4,3,"Hi Team, I was wondering whether this Retail banker is still available in this team. I want to refer my friend for this role. please confirm.",job,0
492,68,4,3,2,"Hi, I have applied for the sick leave on 1977-10-04 with which was approved by my manager but is not reflected on the system. Please resolve the issue.",date,0
493,194,1,3,3,"Hi, I have applied for the sick leave on 2017-09-13 with which was approved by my manager but is not reflected on the system. Please resolve the issue.",date,0
494,58,3,3,2,"Hi, since yesterday I am trying to apply for leave but I am not able to. The system shows an error. I have to take an urgent leave. Please resolve the issue.",,0
495,89,4,5,2,Hi I want to apply for the cashless mode of hospitalization. please provide me the list of hospital that provide cashless mode in my city Port Faithside.,city,0
496,12,2,3,0,"Hi team, my be leave balance shown in the system is not correct as of 1995-02-24. The leave shown are less. Please resolve the issue.",date,0
497,185,3,2,1,"Dear team, I am shifting to Port Tammyview from Johnsonmouth due to business requirement. Please let me know the procedure to claim the travel allowance.",city city,0
498,65,3,2,2,"Dear team, I am shifting to South Bobhaven from Port Gary due to business requirement. Please let me know the procedure to claim the travel allowance.",city city,0
499,115,4,1,2,"Hi,I am Kevin Rodriguez and my employee ID is EMP392-73-7077. 
I am having trouble with my hardware claim, my expense amount was $64.98 for reimbursement. 
My other details such as designation is Engineer, land, userid kmitchell and email is miranda26@gmail.com.",name ssn money job username mail,1
500,169,4,1,2,"Hi, my team needs a new Heater for the project kindly help us to come up with the quote for the said product.",product_name,0
501,14,0,3,3,"Hi team, I am Dr. Justin Villa DVM, employee id 816-51-2342. I want to unpaid leave for the year. I am going to take executive degree from ISB Hyderabad. Thank you.",name ssn,1
502,0,0,7,3,"I am experiencing technical issues with Washing Machine. It shows error code 500. I have tried troubleshooting by going through help documents, but the issue still persists. Please assist me in resolving the issue. My account details are: username karenlindsey, Email moranrebecca@hotmail.com.",product_name username mail,1
503,132,1,2,3,"Hi,I am Emily Pruitt and my employee ID is EMP226-97-6235. 
I am having trouble with my travel claim, my expense amount was $69,542.12 for reimbursement.
 My other details such as designation is Furniture designer and email is mharrington@gmail.com. 
The payment was done with given credit card number 4261787459383558 and credit card type Diners Club / Carte Blanche.",name ssn money job mail credit_card_number cc_provider,1
504,5,2,4,3,"Dear team, I want more members in my team. The project requires more skilled employee for the early completion of client project. My employee id is 034-07-4687. Please initiate the recruitment under my project. thanks",ssn,1
505,38,1,3,2,"Hi team, my be leave balance shown in the system is not correct as of 1986-01-14. The leave shown are less. Please resolve the issue.",date,0
506,3,4,0,2,Hi team I want to access https://www.rodriguez.com/ website for research purpose kindly remove the site from the proxy. My employee id is 575-36-3673 and my profile is Data scientist.,url ssn job,1
